<?xml version="1.0" encoding="UTF-8"?> 
<!DOCTYPE configuration SYSTEM "log4j.dtd">

<configuration configDebug="true">

	<appender name="ASYNC" class="org.log4j.AsyncAppender">
	        <appender-ref ref="TEMP"/>
	</appender>

	<appender name="TEMP" class="org.log4j.FileAppender">
		<param name="File" value="temp"/>
		<layout class="org.log4j.PatternLayout">
  		     <param name="ConversionPattern" 
                            value="%d %-5p [%t] %C{2} (%F:%L) - %m\n"/>
		</layout>
	</appender>

	<root>
		<priority value="debug"/>
		<appender-ref ref="ASYNC"/>
	</root>
</configuration>
