<?xml version="1.0" encoding="UTF-8" ?>
<!DOCTYPE log4j:configuration SYSTEM "log4j.dtd">

<log4j:configuration xmlns:log4j='http://jakarta.apache.org/log4j/'>
  <appender name="NULL" class="org.apache.log4j.FileAppender">
    <param name="File" value="temp"/>
    <param name="Append" value="false"/>
    <param name="ImmediateFlush" value="false"/>
    <param name="BufferedIO" value="true"/>
    <layout class="org.apache.log4j.TTCCLayout">
      <param name="DateFormat" 
	value="ISO8601"/>
    </layout>
  </appender>
  
  <category name="A0123456789">  	
    <priority value ="info" />
  </category>  	
  
  <root>
    <priority value ="debug" />
    <appender-ref ref="NULL" />
  </root>
  
</log4j:configuration>
