<?xml version="1.0" encoding="UTF-8" ?>
<!DOCTYPE log4j:configuration SYSTEM "log4j.dtd">

<log4j:configuration xmlns:log4j='http://jakarta.apache.org/log4j/'
                     configDebug="true">

	<appender name="TEMP" class="org.apache.log4j.FileAppender">
                <param name="Append" value="false" />
		<param name="File"   value="current.reg" />
		<layout class="org.apache.log4j.PatternLayout">
 		    <param name="ConversionPattern"
		           value="%-5p %c{2} - %m\n"/>
		</layout>

		<filter class="org.apache.log4j.varia.PriorityMatchFilter">
                  <param name="PriorityToMatch" value="TRACE#org.apache.log4j.xml.examples.XPriority" />
                  <param name="AcceptOnMatch" value="true" />
		</filter>


	</appender>
 
	<root>
          <appender-ref ref="TEMP" />	
          <priority value ="TRACE" class="org.apache.log4j.xml.examples.XPriority"/>       
	</root>
</log4j:configuration>
