<?xml version="1.0" encoding="UTF-8" ?>
<!DOCTYPE log4j:configuration SYSTEM "log4j.dtd">
<!--
 Licensed to the Apache Software Foundation (ASF) under one or more
 contributor license agreements.  See the NOTICE file distributed with
 this work for additional information regarding copyright ownership.
 The ASF licenses this file to You under the Apache License, Version 2.0
 (the "License"); you may not use this file except in compliance with
 the License.  You may obtain a copy of the License at

      http://www.apache.org/licenses/LICENSE-2.0

 Unless required by applicable law or agreed to in writing, software
 distributed under the License is distributed on an "AS IS" BASIS,
 WITHOUT WARRANTIES OR CONDITIONS OF ANY KIND, either express or implied.
 See the License for the specific language governing permissions and
 limitations under the License.

-->

<log4j:configuration xmlns:log4j='http://jakarta.apache.org/log4j/'>
        <appender name="ASYNC" class="org.apache.log4j.AsyncAppender">
   	   <appender-ref ref="TEMP" />
	</appender>

        <appender name="TEMP" class="org.apache.log4j.FileAppender">
           <param name="File" value="test"/>
           <param name="Append" value="false"/>
           <param name="ImmediateFlush" value="false"/>
           <layout class="org.apache.log4j.SimpleLayout">
	   </layout>
	</appender>
 
        <category name="A0123456789">  	
	   <priority value ="info" />
        </category>  	

	<root>
	   <priority value ="debug" />
   	   <appender-ref ref="ASYNC" />
	</root>
	
</log4j:configuration>
