<?xml version="1.0" encoding="UTF-8" ?>
<!DOCTYPE log4j:configuration SYSTEM "log4j.dtd">

<log4j:configuration xmlns:log4j='http://jakarta.apache.org/log4j/'>
        <appender name="TEMP" class="org.apache.log4j.FileAppender">
           <param name="File" value="temp"/>
           <param name="Append" value="false"/>

           <layout class="org.apache.log4j.PatternLayout">
              <param name="ConversionPattern" 
                     value="%r [%t] %-5p %c - %m%n"/>
	   </layout>
	</appender>
 
        <category name="A0123456789">  	
	   <priority value ="info" />
        </category>  	

	<root>
	   <priority value ="debug" />
   	   <appender-ref ref="TEMP" />
	</root>
	
</log4j:configuration>
