<?xml version="1.0" encoding="UTF-8" ?>
<!DOCTYPE configuration SYSTEM "log4j.dtd">

<!-- PropertyConfigurator equivalent:
log4j.rootCategory=, NULL
log4j.category.A0123456789=INFO
log4j.appender.NULL=org.apache.log4j.performance.NullAppender
log4j.appender.NULL.layout=org.apache.log4j.TTCCLayout
log4j.appender.NULL.layout.DateFormat=RELATIVE
-->
<configuration>

        <appender name="NULL" class="org.apache.log4j.performance.NullAppender">
           <layout class="org.apache.log4j.TTCCLayout">
              <param name="DateFormat" value="ISO8601"/>
	   </layout>
	</appender>
 
        <category name="A0123456789">  	
	   <priority value ="info" />
        </category>  	

	<root>
	   <priority value ="debug" />
   	   <appender-ref ref="NULL" />
	</root>
	
</configuration>
