<?xml version="1.0" encoding="UTF-8" ?>
<!DOCTYPE log4j:configuration SYSTEM "log4j.dtd">

<log4j:configuration xmlns:log4j='http://jakarta.apache.org/log4j/'>

  <appender name="TEMP" class="org.apache.log4j.FileAppender">
    <param name="Append" value="false" />
    <param name="File"   value="output/temp" />
    <layout class="org.apache.log4j.PatternLayout">
      <param name="ConversionPattern"
	value="%-5p %c{2} - %m\n"/>
    </layout>
  </appender>

  <root>
    <level value="TRACE" class="org.apache.log4j.xml.XLevel"/>
    <appender-ref ref="TEMP" />
  </root>
</log4j:configuration>