<?xml version="1.0" encoding="UTF-8" ?>
<!DOCTYPE log4j:configuration SYSTEM "log4j.dtd">

<log4j:configuration>
        <appender name="NULL" class="org.apache.log4j.net.SocketAppender">
           <param name="RemoteHost" value="localhost"/>
           <param name="Port" value="1000"/>
           <param name="ReconnectionDelay" value="1000"/>
	</appender>
 
        <category name="A0123456789">  	
	   <priority value ="info" />
        </category>  	

	<root>
	   <priority value ="debug" />
   	   <appender-ref ref="NULL" />
	</root>
	
</log4j:configuration>
