<?xml version="1.0" encoding="UTF-8" ?>
<!DOCTYPE configuration SYSTEM "log4j.dtd">

<!-- Test DOMConfigurator for

    with disableOverride=true 
    with undefined configDebug param element

    without DTD 
 -->
<configuration disableOverride="true">
	<appender name="A1" class="org.apache.log4j.FileAppender">

            <param name="File" value="System.out" />
            <layout class="org.apache.log4j.PatternLayout">
		<param name="ConversionPattern"
		       value="TEST8: %5p %c{2} - %m%n"/>
            </layout>	    
	</appender>
		
	<root>
	   <priority value ="debug" />
   	   <appender-ref ref="A1" />
	</root>
	
</configuration>
