<?xml version="1.0" encoding="UTF-8" ?>
<!DOCTYPE configuration SYSTEM "log4j.dtd">

<configuration>
        <appender name="ASYNC" class="org.apache.log4j.AsyncAppender">
   	   <appender-ref ref="TEMP" />
	</appender>

        <appender name="TEMP" class="org.apache.log4j.FileAppender">
           <param name="File" value="temp"/>
           <param name="Append" value="false"/>
           <param name="ImmediateFlush" value="false"/>
           <layout class="org.apache.log4j.PatternLayout">
              <param name="ConversionPattern" 
                     value="%r [%t] %-5p %c - %m%n"/>
	   </layout>
	</appender>
 
        <category name="A0123456789">  	
	   <priority value ="info" />
        </category>  	

	<root>
	   <priority value ="debug" />
   	   <appender-ref ref="ASYNC" />
	</root>
	
</configuration>
