<?xml version="1.0" encoding="UTF-8" ?>
<!DOCTYPE configuration SYSTEM "log4j.dtd">

<configuration>
	<appender name="A1" class="org.apache.log4j.FileAppender">

            <param name="File"   value="temp.A1" />
            <param name="Append" value="false" />	    
	
            <layout class="org.apache.log4j.PatternLayout">
		<param name="ConversionPattern" value="%-5p %c{2} - %m\n"/>
            </layout>	    
	</appender>
	
	<appender name="A2" class="org.apache.log4j.FileAppender">
		<param name="File" value="temp.A2" />
		<param name="Append" value="false" />
		<layout class="org.apache.log4j.TTCCLayout">
  		  <param name="DateFormat" value="ISO8601" />
		</layout>		
	</appender>
	
	<category name="org.apache.log4j.xml">
	  <priority value="debug" />
  	  <appender-ref ref="A1" />
	</category>
	
	<root>
	   <priority value ="debug" />
   	   <appender-ref ref="A1" />
	   <appender-ref ref="A2" />
	</root>
	
</configuration>
